metric_name,metric_type,interval,unit_name,per_unit_name,description,orientation,integration,short_name
datadog.marketplace.rapdev.nutanix,gauge,15,,,,1,rapdev_nutanix,
rapdev.nutanix.num_io,gauge,15,,,Number of I/O reported,1,rapdev_nutanix,
rapdev.nutanix.write_io,gauge,15,microsecond,,Write I/O latency of the host in percentage,1,rapdev_nutanix,
rapdev.nutanix.avg_io_latency_usecs,gauge,15,,,Average read and write I/O latency of the host in microseconds reported,1,rapdev_nutanix,
rapdev.nutanix.num_read_iops,gauge,15,,,Rate of the host reads in IOPS reported,1,rapdev_nutanix,
rapdev.nutanix.num_write_iops,gauge,15,,,Rate of the VM writes in IOPS reported,1,rapdev_nutanix,
rapdev.nutanix.read_io_bandwidth_kBps,gauge,15,,,Read IO bandwidth of the VM in kilobytes per second reported,1,rapdev_nutanix,
rapdev.nutanix.write_io_bandwidth_kBps,gauge,15,,,Write IO bandwidth of the VM in kilobytes per second reported,1,rapdev_nutanix,
rapdev.nutanix.content_cache_hit,gauge,15,,,Content Cache Hit in percentage,1,rapdev_nutanix,
rapdev.nutanix.storage.usage_bytes,gauge,15,byte,,Storage used in bytes,1,rapdev_nutanix,
rapdev.nutanix.storage.capacity_bytes,gauge,15,byte,,Total storage capacity in bytes,1,rapdev_nutanix,
rapdev.nutanix.storage.free_bytes,gauge,15,byte,,Available storage in bytes,1,rapdev_nutanix,
rapdev.nutanix.content_cache_logical_memory_usage_bytes,gauge,15,byte,,Logical memory used by the content cache,1,rapdev_nutanix,
rapdev.nutanix.content_cache_physical_memory_usage_bytes,gauge,15,byte,,Physical memory used by the content cache,1,rapdev_nutanix,
rapdev.nutanix.data_reduction.compression.saving_ratio,gauge,15,,,Storage saved by data compression,1,rapdev_nutanix,
rapdev.nutanix.data_reduction.dedup.saving_ratio,gauge,15,,,Storage saved by deduplication,1,rapdev_nutanix,
rapdev.nutanix.hypervisor_cpu_usage,gauge,15,,,Percentage of the total CPU cycles currently in use by the host,1,rapdev_nutanix,
rapdev.nutanix.hypervisor_memory_usage,gauge,15,,,Percentage of the memory used by the VM out of the total configured memory reported by the hypervisor,1,rapdev_nutanix,
rapdev.nutanix.hypervisor_num_read_iops,gauge,15,,,Average of the read I/O latency of the VM in microseconds reported by the hypervisor,1,rapdev_nutanix,
rapdev.nutanix.hypervisor_num_write_iops,gauge,15,,,Average of the write I/O latency of the VM in microseconds reported by the hypervisor,1,rapdev_nutanix,
rapdev.nutanix.hypervisor_avg_read_io_latency_usecs,gauge,15,microsecond,,Average of the read I/O latency of the VM in microseconds reported by the hypervisor,1,rapdev_nutanix,
rapdev.nutanix.hypervisor_avg_write_io_latency_usecs,gauge,15,microsecond,,Average of the write I/O latency of the VM in microseconds reported by the hypervisor,1,rapdev_nutanix,
rapdev.nutanix.hypervisor.cpu_ready_time,gauge,15,,,Percentage of the time a virtual machine waits to use the physical CPU out of the total CPU time allotted to the VM,1,rapdev_nutanix,
rapdev.nutanix.memory_usage,gauge,15,,,Percentage of the total memory currently in use by the host,1,rapdev_nutanix,
rapdev.nutanix.controller_num_iops,gauge,15,,,Rate of the VM read and writes in IOPS reported by the controller,1,rapdev_nutanix,
rapdev.nutanix.controller_num_write_io,gauge,15,,,Number of write I/O reported by the controller,1,rapdev_nutanix,
rapdev.nutanix.controller_num_write_iops,gauge,15,,,Rate of the VM writes in IOPS reported by the controller,1,rapdev_nutanix,
rapdev.nutanix.controller_num_read_iops,gauge,15,,,Rate of the VM reads in IOPS reported by the controller,1,rapdev_nutanix,
rapdev.nutanix.controller_avg_write_io_latency_usecs,gauge,15,microsecond,,Average of the write I/O latency of the VM in microseconds reported by the controller,1,rapdev_nutanix,
rapdev.nutanix.controller_avg_read_io_latency_usecs,gauge,15,microsecond,,Average of the read I/O latency of the VM in microseconds reported by the controller,1,rapdev_nutanix,
rapdev.nutanix.controller_io_bandwidth_kBps,gauge,15,,,Read and write IO bandwidth of the VM in kilobytes per second reported by the controller,1,rapdev_nutanix,
rapdev.nutanix.controller_avg_io_latency_usecs,gauge,15,microsecond,,Average of the read and write I/O latency of the VM in microseconds reported by the controller,1,rapdev_nutanix,
rapdev.nutanix.clusters.count,gauge,15,,,Number of clusters assigned per CVM,1,rapdev_nutanix,
rapdev.nutanix.disks.count,gauge,15,,,Number of disks assigned per CVM,1,rapdev_nutanix,
rapdev.nutanix.vms.count,gauge,15,,,Number of vms assigned per CVM,1,rapdev_nutanix,
rapdev.nutanix.storage_pools.count,gauge,15,,,Number of storage_pools assigned per CVM,1,rapdev_nutanix,
rapdev.nutanix.virtual_disks.count,gauge,15,,,Number of virtual disks assigned per CVM,1,rapdev_nutanix,
rapdev.nutanix.license.days_left,gauge,15,,,Number of days remaining on the Nutanix license,1,rapdev_nutanix,
rapdev.nutanix.containers.count,gauge,15,,,Number of containers in Nutanix Cluster,1,rapdev_nutanix,
rapdev.nutanix.storage.logical_usage_bytes,gauge,15,,,Amount of logical storage used in bytes,1,rapdev_nutanix,
rapdev.nutanix.clusters.replication_received_bandwidth_kBps,gauge,15,,,Replication data received in KB/s,1,rapdev_nutanix,
rapdev.nutanix.clusters.replication_transmitted_bandwidth_kBps,gauge,15,,,Replication data transmitted in KB/s,1,rapdev_nutanix,
rapdev.nutanix.protection_domains.replication_transmitted_bandwidth_kBps,gauge,15,,,Replication data transmitted in KB/s,1,rapdev_nutanix,
rapdev.nutanix.protection_domains.replication_received_bandwidth_kBps,gauge,15,,,Replication data received in KB/s,1,rapdev_nutanix,
rapdev.nutanix.protection_domains.replication_num_transmitted_bytes,gauge,15,byte,,Replication data transmitted,1,rapdev_nutanix,
rapdev.nutanix.protection_domains.replication_num_received_bytes,gauge,15,byte,,Replication data received,1,rapdev_nutanix,
rapdev.nutanix.protection_domains.lws_store_used_bytes,gauge,15,byte,,Protection domain lws storage used,1,rapdev_nutanix,
rapdev.nutanix.protection_domains.dr.exclusive_snapshot_usage_bytes,gauge,15,byte,,Protection domain disaster recovery snapshot usage,1,rapdev_nutanix,
rapdev.nutanix.protection_domains.controller_total_read_io_time_usecs,gauge,15,microsecond,,Protection domain controller read I/O time,1,rapdev_nutanix,
rapdev.nutanix.protection_domains.controller_total_read_io_size_kbytes,gauge,15,kibibyte,,Protection domain controller read I/O size,1,rapdev_nutanix,
rapdev.nutanix.protection_domains.controller_total_io_time_usecs,gauge,15,microsecond,,Protection domain controller total I/O time,1,rapdev_nutanix,
rapdev.nutanix.protection_domains.controller_total_io_size_kbytes,gauge,15,kibibyte,,Protection domain controller total I/O size,1,rapdev_nutanix,
rapdev.nutanix.protection_domains.controller_timespan_usecs,gauge,15,microsecond,,Protection domain controller timespan,1,rapdev_nutanix,
rapdev.nutanix.protection_domains.controller_num_read_io,gauge,15,,,Protection domain controller number of read I/O operations,1,rapdev_nutanix,
rapdev.nutanix.protection_domains.controller_num_random_io,gauge,15,,,Protection domain controller number of random I/O operations,1,rapdev_nutanix,
rapdev.nutanix.protection_domains.controller_num_io,gauge,15,,,Protection domain controller I/O operations,1,rapdev_nutanix,
rapdev.nutanix.protection_domains.snapshots.count,gauge,15,,,Number of snapshots,1,rapdev_nutanix,
